Date & Time,SKU,Name,Brand,Average Rating,Rating Count,Sponsered,Price,Sales Price,Express,Rank,Link
2024-12-21 17:32:38,Z249EBB45716CC045A863Z,"Lemon 4-Pair Non-slip Yoga Socks, Cotton Pilates Socks with Straps, Breathable&Moisture-Wicking&Machine-Washable, Ideal for Yoga/Pilates/Ballet/Dance/Workout (Pink+Black+Grey+Brown, Fit Size 36-42) ",Lemon,NA,NA,Y, ,39.20,Y,1,https://www.noon.com/uae-en/4-pair-non-slip-yoga-socks-cotton-pilates-socks-with-straps-breathable-moisture-wicking-machine-washable-ideal-for-yoga-pilates-ballet-dance-workout-pink-black-grey-brown-fit-size-36-42/Z249EBB45716CC045A863Z/p/?o=z249ebb45716cc045a863z-1
2024-12-21 17:32:38,Z184FBC1B30D0C5DACA2DZ,ORiTi Stretch Strap with Exercise Guide Versatile Multi-Loop Perfect for Yoga Pilates and Physical Therapy Portable Helps Improve Flexibility ,ORiTi,4.8,3,Y, ,28,Y,23,https://www.noon.com/uae-en/stretch-strap-with-exercise-guide-versatile-multi-loop-perfect-for-yoga-pilates-and-physical-therapy-portable-helps-improve-flexibility/Z184FBC1B30D0C5DACA2DZ/p/?o=z184fbc1b30d0c5daca2dz-1
2024-12-21 17:32:38,N20034889A,Generic Anti-Tear Exercise Mat With Carrying Strap ,Generic,4.3,1.6K,N,NA,39.45,Y,21,https://www.noon.com/uae-en/anti-tear-exercise-mat-with-carrying-strap/N20034889A/p/?o=f2d873be1dd8236b
2024-12-21 17:32:38,Z30868C98E61D2ABA2621Z,"MahMir Mahmir® EVA Foam Roller for Yoga, Deep Tissue Massage, Stretching, Physical Therapy, Relieve Stress, Improve Mobility with Foam Roller for Legs and Muscles - Deep Tissue Massage Tool (Pink) ",MahMir,4.0,8,Y,NA,29.95,Y,19,https://www.noon.com/uae-en/mahmir-eva-foam-roller-for-yoga-deep-tissue-massage-stretching-physical-therapy-relieve-stress-improve-mobility-with-foam-roller-for-legs-and-muscles-deep-tissue-massage-tool-pink/Z30868C98E61D2ABA2621Z/p/?o=z30868c98e61d2aba2621z-1
2024-12-21 17:32:38,Z143BA04D58F71AF3CC94Z,"GROIC Fitness Yoga Mat for Women and Men - Large, 4mm Thick, 68 Inch *24 Inch, Non Slip Exercise Mats w/ 70 Printed Yoga Poses for Pilates, Workout and Stretching - Home and Gym Essentials ",GROIC,5.0,7,N, ,87.40,Y,20,https://www.noon.com/uae-en/fitness-yoga-mat-for-women-and-men-large-4mm-thick-68-inch-24-inch-non-slip-exercise-mats-w-70-printed-yoga-poses-for-pilates-workout-and-stretching-home-and-gym-essentials/Z143BA04D58F71AF3CC94Z/p/?o=z143ba04d58f71af3cc94z-1
2024-12-21 17:32:38,Z4CB58C8A30F63107B73FZ,Cool Baby Style COOLBABY Pilates Multifunctional Yoga Bed.Pilates Core Bed.Fitness Equipment.Pilates Training Bed.Strength Adjustment.Solid Wood ,Cool Baby Style,NA,NA,N,NA,"4,779",N,22,https://www.noon.com/uae-en/coolbaby-pilates-multifunctional-yoga-bed-pilates-core-bed-fitness-equipment-pilates-training-bed-strength-adjustment-solid-wood/Z4CB58C8A30F63107B73FZ/p/?o=z4cb58c8a30f63107b73fz-1
2024-12-21 17:32:38,Z4882AD10A617AAC52EADZ,Gaiam Chakra Yoga Mat Bag ,Gaiam,NA,NA,N, ,109,Y,134,https://www.noon.com/uae-en/chakra-yoga-mat-bag/Z4882AD10A617AAC52EADZ/p/?o=z4882ad10a617aac52eadz-1
2024-12-21 17:32:38,N22815219A,Kanteen Store Anti Burst Sports Swiss Yoga Aerobic Body Fitness Ball 65cm 65cm ,Kanteen Store,4.4,294,N, ,29.85,Y,135,https://www.noon.com/uae-en/anti-burst-sports-swiss-yoga-aerobic-body-fitness-ball-65cm-65cm/N22815219A/p/?o=cd4a3abe48782d5a
2024-12-21 17:32:38,ZB0ABF4DF8F76F9BEE598Z,Generic Punching bags Standing punching bags are available for families of adults or children ,Generic,5.0,3,N,NA,599,Y,18,https://www.noon.com/uae-en/punching-bags-standing-punching-bags-are-available-for-families-of-adults-or-children/ZB0ABF4DF8F76F9BEE598Z/p/?o=zb0abf4df8f76f9bee598z-1
2024-12-21 17:32:38,Z44692B2FD732E550BC63Z,"Unique Resistance Bands, Elastic Exercise Bands for Working Out, Physical Therapy, Recovery, Yoga, Pilates, Strength Training ",Unique,4.9,5,N, ,23.50,Y,132,https://www.noon.com/uae-en/resistance-bands-elastic-exercise-bands-for-working-out-physical-therapy-recovery-yoga-pilates-strength-training/Z44692B2FD732E550BC63Z/p/?o=z44692b2fd732e550bc63z-1
2024-12-21 17:32:38,Z24E1B5B4FDE8BB5C6111Z,"Bernessi 8MM Yoga Mat with Carrying Strap Anti-Slip for Home Workout Exercises Meditation Eco Friendly, Non Skid TPE Yoga Mattres for Pilates 183x61x0.8cm Thick, Pink/Black Color ",Bernessi,4.8,65,N, ,69.90,Y,17,https://www.noon.com/uae-en/8mm-yoga-mat-with-carrying-strap-anti-slip-for-home-workout-exercises-meditation-eco-friendly-non-skid-tpe-yoga-mattres-for-pilates-183x61x0-8cm-thick-pink-black-color/Z24E1B5B4FDE8BB5C6111Z/p/?o=z24e1b5b4fde8bb5c6111z-1
2024-12-21 17:32:38,Z23067B03F54054219A1CZ,Gaiam Yoga Beginners Kit Lily Shadow ,Gaiam,NA,NA,N, ,158,Y,131,https://www.noon.com/uae-en/yoga-beginners-kit-lily-shadow/Z23067B03F54054219A1CZ/p/?o=z23067b03f54054219a1cz-1
2024-12-21 17:32:38,N16529616A,body heart Yoga Ball With Air Pump - 65 cm 65cm 65cm ,body heart,4.3,62,N, ,27.20,Y,137,https://www.noon.com/uae-en/yoga-ball-with-air-pump-65-cm-65cm-65cm/N16529616A/p/?o=be578ba74d4a4a8f
2024-12-21 17:32:38,N43250378A,Rock Pow Acupressure Mat 66 x 42cm ,Rock Pow,NA,NA,N, ,59,Y,130,https://www.noon.com/uae-en/acupressure-mat-66-x-42cm/N43250378A/p/?o=fea16ff4a291debe
2024-12-21 17:32:38,ZC6C0044F2081F98BB4CFZ,Generic Pilates Yoga Wedge Massage Correction Yoga Foam Kyphosis Correction Detachable Large Spine Yoga Equipment ,Generic,NA,NA,N,NA,299,Y,133,https://www.noon.com/uae-en/pilates-yoga-wedge-massage-correction-yoga-foam-kyphosis-correction-detachable-large-spine-yoga-equipment/ZC6C0044F2081F98BB4CFZ/p/?o=zc6c0044f2081f98bb4cfz-1
2024-12-21 17:32:38,ZA9BFB7369713E4E6A4A8Z,GROIC 5 Pcs Pilates Ring Set Yoga Fitness Magic Circle Pilates Equipment for Home Workouts Fitness kit Includes Burst Resistant Pilates Mini Ball & Highly Elastic Resistance Bands ,GROIC,NA,NA,N, ,80.45,N,128,https://www.noon.com/uae-en/5-pcs-pilates-ring-set-yoga-fitness-magic-circle-pilates-equipment-for-home-workouts-fitness-kit-includes-burst-resistant-pilates-mini-ball-highly-elastic-resistance-bands/ZA9BFB7369713E4E6A4A8Z/p/?o=a3cf917d4499993f
2024-12-21 17:32:38,Z9F9959795903122BD6DEZ,PUMA Yoga Training Mat ,PUMA,NA,NA,N, ,139,Y,136,https://www.noon.com/uae-en/yoga-training-mat/Z9F9959795903122BD6DEZ/p/?o=z9f9959795903122bd6dez-1
2024-12-21 17:32:38,Z4247101839A17521A8B9Z,"Spall Yoga Mat Non Slip,Yoga Mat with Strap Included 10mm Thick Exercise Mat Yoga and Many Other Home Workouts ",Spall,5.0,5,N, ,42,N,125,https://www.noon.com/uae-en/yoga-mat-non-slip-yoga-mat-with-strap-included-10mm-thick-exercise-mat-yoga-and-many-other-home-workouts/Z4247101839A17521A8B9Z/p/?o=z4247101839a17521a8b9z-1
2024-12-21 17:32:38,ZA4FB2C673210B38D137AZ,Generic Dancing Shoes Soft Bottom Practice Ballet with Cloth Head Shoes for Girls White Color ,Generic,4.4,18,N,NA,35,N,126,https://www.noon.com/uae-en/dancing-shoes-soft-bottom-practice-ballet-with-cloth-head-shoes-for-girls-white-color/ZA4FB2C673210B38D137AZ/p/?o=za4fb2c673210b38d137az-2
2024-12-21 17:32:38,Z1A0EB1E6C4C1E349C57CZ,RIOXS 2 Pair Sandbag for Leg Weights and Wrist Weights with Adjustable Strap for Fitness Resistance Training Running Training Exercise Gym Running SandBag ,RIOXS,5.0,2,N, ,43.20,N,122,https://www.noon.com/uae-en/2-pair-sandbag-for-leg-weights-and-wrist-weights-with-adjustable-strap-for-fitness-resistance-training-running-training-exercise-gym-running-sandbag/Z1A0EB1E6C4C1E349C57CZ/p/?o=d843439836bf58ba
2024-12-21 17:32:38,ZE4D54B66966654A0570FZ,"GROIC Yoga Mat, Extra Wide 72""x 31.9"" x 0.24"" Pilates Fitness Mats with Alignment Marks, Non Slip Fitness Yoga Mats, Exercise Mats for Yoga Pilates Home Floor Workout with Carrying Sling and Storage Bag ",GROIC,NA,NA,N, ,112.95,Y,123,https://www.noon.com/uae-en/yoga-mat-extra-wide-72-x-31-9-x-0-24-pilates-fitness-mats-with-alignment-marks-non-slip-fitness-yoga-mats-exercise-mats-for-yoga-pilates-home-floor-workout-with-carrying-sling-and-storage-bag/ZE4D54B66966654A0570FZ/p/?o=ze4d54b66966654a0570fz-1
2024-12-21 17:32:38,N43426712A,Generic Back Massager Stretcher 40x25x3cm ,Generic,3.6,101,N, ,14,Y,124,https://www.noon.com/uae-en/back-massager-stretcher-40x25x3cm/N43426712A/p/?o=fd12b7059f979fdd
2024-12-21 17:32:38,Z68802DAE7D5FCFB63AB8Z,joyzzz Yoga fitness mat floor high quality environmentally friendly TPE waterproof gym home mat sports mat for sports ,joyzzz,NA,NA,N,NA,120,Y,121,https://www.noon.com/uae-en/yoga-fitness-mat-floor-high-quality-environmentally-friendly-tpe-waterproof-gym-home-mat-sports-mat-for-sports/Z68802DAE7D5FCFB63AB8Z/p/?o=z68802dae7d5fcfb63ab8z-1
2024-12-21 17:32:38,ZD0F9EADF94C847916735Z,"Generic Pilates Ring, Magic Circle Pilates Ring 35.5CM For Thigh Exercise, Home Pilates Equipment For Women, Pilates Ring Gym Equipment Thigh Master ",Generic,NA,NA,N, ,56.20,Y,120,https://www.noon.com/uae-en/pilates-ring-magic-circle-pilates-ring-35-5cm-for-thigh-exercise-home-pilates-equipment-for-women-pilates-ring-gym-equipment-thigh-master/ZD0F9EADF94C847916735Z/p/?o=zd0f9eadf94c847916735z-1
2024-12-21 17:32:38,Z803968E97E86E5DA8974Z,"Generic Non Slip Socks for Women, All Season Fashion, Simple Casual Sports Socks,  Yoga, Ballet, Dance, Fitness, Football, Hospital, Medium Size Socks, Free Size 2pcs ",Generic,5.0,1,N, ,31.80,Y,119,https://www.noon.com/uae-en/non-slip-socks-for-women-all-season-fashion-simple-casual-sports-socks-yoga-ballet-dance-fitness-football-hospital-medium-size-socks-free-size-2pcs/Z803968E97E86E5DA8974Z/p/?o=z803968e97e86e5da8974z-1
2024-12-21 17:32:38,ZF098AC350172402D4A04Z,"GROIC 2 PCs Cooling Towels Outdoors Sports Breathable Towel Workout,  Quick-Drying Sports Towel for Gym, Fitness, Golf, Yoga, Camping, Hiking, Travel, Outdoor Activities,30*100 CM ",GROIC,3.7,3,N, ,55.65,Y,127,https://www.noon.com/uae-en/2-pcs-cooling-towels-outdoors-sports-breathable-towel-workout-quick-drying-sports-towel-for-gym-fitness-golf-yoga-camping-hiking-travel-outdoor-activities-30-100-cm/ZF098AC350172402D4A04Z/p/?o=zf098ac350172402d4a04z-1
2024-12-21 17:32:38,ZF3442D6DEB1F18D07AD9Z,"Generic Stretch Band Strap, Elastic Exercise Stretching Band with 9 Loops for Yoga Physical Therapy Dance Workout Fitness, Stretch Assist - Light Resistance Band for Strength Flexibility Training ",Generic,NA,NA,N,NA,29,Y,117,https://www.noon.com/uae-en/stretch-band-strap-elastic-exercise-stretching-band-with-9-loops-for-yoga-physical-therapy-dance-workout-fitness-stretch-assist-light-resistance-band-for-strength-flexibility-training/ZF3442D6DEB1F18D07AD9Z/p/?o=zf3442d6deb1f18d07ad9z-1
2024-12-21 17:32:38,Z5BB144BA6576302F7275Z,MahMir MahMir Yoga Mat Anti-Slip Exercise Mat with Carrying Bag Fitness Mat for Pilates 183CM*61CM*6MM Thickness for Woman Man Beginners (Green + Black) ,MahMir,4.8,8,N, ,49.95,Y,116,https://www.noon.com/uae-en/mahmir-yoga-mat-anti-slip-exercise-mat-with-carrying-bag-fitness-mat-for-pilates-183cm-61cm-6mm-thickness-for-woman-man-beginners-green-black/Z5BB144BA6576302F7275Z/p/?o=z5bb144ba6576302f7275z-1
2024-12-21 17:32:38,N27330175A,Fitness World Anti-Slip Yoga Mat With Carry Strap ,Fitness World,4.1,216,N,NA,37.85,Y,118,https://www.noon.com/uae-en/anti-slip-yoga-mat-with-carry-strap/N27330175A/p/?o=f2f2a89d50d79c1a
2024-12-21 17:32:38,Z32D13B61AE4FACD618EAZ,Reebok Yoga Mat - 4Mm - Black ,Reebok,NA,NA,N, ,64,Y,115,https://www.noon.com/uae-en/yoga-mat-4mm-black/Z32D13B61AE4FACD618EAZ/p/?o=z32d13b61ae4facd618eaz-1
2024-12-21 17:32:38,ZE3AE3C2A87B662CA54F9Z,Gaiam 6Mm Premium Tribal Wisdom Yoga Mat ,Gaiam,NA,NA,N, ,50,Y,114,https://www.noon.com/uae-en/6mm-premium-tribal-wisdom-yoga-mat/ZE3AE3C2A87B662CA54F9Z/p/?o=ze3ae3c2a87b662ca54f9z-1
2024-12-21 17:32:38,N20034892A,Generic Anti-Tear Exercise Mat With Carrying Strap 60x10cm 60x10cm ,Generic,4.2,1.4K,N,NA,36.15,Y,112,https://www.noon.com/uae-en/anti-tear-exercise-mat-with-carrying-strap-60x10cm-60x10cm/N20034892A/p/?o=fc5fc96b5ab2231d
2024-12-21 17:32:38,ZD6C0242EBD64EE1D929FZ,WENBO Set of 2 Yoga Blocks EVA Foam High Density Non Slip Yoga Bricks For Meditation Balance Exercise ,WENBO,NA,NA,N,NA,26,N,111,https://www.noon.com/uae-en/set-of-2-yoga-blocks-eva-foam-high-density-non-slip-yoga-bricks-for-meditation-balance-exercise/ZD6C0242EBD64EE1D929FZ/p/?o=zd6c0242ebd64ee1d929fz-1
2024-12-21 17:32:38,Z60F077CA3FE2E737E759Z,RIOXS 5 Pairs Yoga Socks For Women Non-Slip Grips & Straps Non Slip Socks For Yoga Pilates Ideal For Pilates Ballet Dance Barefoot Workout ,RIOXS,4.4,3,N, ,41.45,Y,110,https://www.noon.com/uae-en/5-pairs-yoga-socks-for-women-non-slip-grips-straps-non-slip-socks-for-yoga-pilates-ideal-for-pilates-ballet-dance-barefoot-workout/Z60F077CA3FE2E737E759Z/p/?o=z60f077ca3fe2e737e759z-1
2024-12-21 17:32:38,ZF7A2908DEBCB5813160FZ,RIOXS 8 Pairs Non Slip Skid Yoga Pilates Socks for Women and Men Breathable Sports Socks for Yoga Barre Pilates Home Workout ,RIOXS,4.0,1,N, ,46.05,Y,113,https://www.noon.com/uae-en/8-pairs-non-slip-skid-yoga-pilates-socks-for-women-and-men-breathable-sports-socks-for-yoga-barre-pilates-home-workout/ZF7A2908DEBCB5813160FZ/p/?o=zf7a2908debcb5813160fz-1
2024-12-21 17:32:38,ZFB0F8817C8CE6FD17614Z,"GROIC Foldable Yoga Mat with Illustrated Yoga Poses, Non Slip Exercise Mat for Home Gym, Travel Yoga Set With Stretch Strap for Yoga Pilates and Fitness ",GROIC,3.8,5,N, ,88.65,Y,109,https://www.noon.com/uae-en/foldable-yoga-mat-with-illustrated-yoga-poses-non-slip-exercise-mat-for-home-gym-travel-yoga-set-with-stretch-strap-for-yoga-pilates-and-fitness/ZFB0F8817C8CE6FD17614Z/p/?o=zfb0f8817c8ce6fd17614z-1
2024-12-21 17:32:38,ZF4B0CB30B8A68912AB54Z,Gaiam TPE YOGA MAT PRINTED BLUSH 6MM ,Gaiam,NA,NA,N, ,168,Y,107,https://www.noon.com/uae-en/tpe-yoga-mat-printed-blush-6mm/ZF4B0CB30B8A68912AB54Z/p/?o=zf4b0cb30b8a68912ab54z-1
2024-12-21 17:32:38,ZAB57DC624A6EE9AFFB80Z,"Sweet seven Women's Non-Slip Pilates Socks with Grips - Perfect for Yoga, Ballet, Dance, and Barefoot Workouts - Anti-Skid Crew Socks - Set of 4 ",Sweet seven,NA,NA,N,NA,83.95,Y,106,https://www.noon.com/uae-en/women-s-non-slip-pilates-socks-with-grips-perfect-for-yoga-ballet-dance-and-barefoot-workouts-anti-skid-crew-socks-set-of-4/ZAB57DC624A6EE9AFFB80Z/p/?o=zab57dc624a6ee9affb80z-1
2024-12-21 17:32:38,Z2900192DEE4F310FC919Z,"GROIC Yoga Mat Bag with Bottom Pocket,Exercise Yoga Mat Carrier Multi-Functional Storage Bag,Yoga Gym Bag,Yoga Mat Carrier Bag for Class Workout Park ",GROIC,4.0,1,N, ,55.65,Y,108,https://www.noon.com/uae-en/yoga-mat-bag-with-bottom-pocket-exercise-yoga-mat-carrier-multi-functional-storage-bag-yoga-gym-bag-yoga-mat-carrier-bag-for-class-workout-park/Z2900192DEE4F310FC919Z/p/?o=z2900192dee4f310fc919z-1
2024-12-21 17:32:38,Z99D0F066ABAAA43F903AZ,Align-Pilates Align-Pilates R8 Pro Reformer Platform Extender – Upgrade for Enhanced Stability & Support in Pilates Workouts ,Align-Pilates,NA,NA,N, ,375.25,N,105,https://www.noon.com/uae-en/align-pilates-r8-pro-reformer-platform-extender-upgrade-for-enhanced-stability-support-in-pilates-workouts/Z99D0F066ABAAA43F903AZ/p/?o=z99d0f066abaaa43f903az-1
2024-12-21 17:32:38,Z7918EF223E8946F8A08CZ,Generic 6 Pairs Anti Slip Yoga Socks For Women，Non Slip Socks Pilates Socks For Yoga，Pilates，Ballet，Dance，Workout ,Generic,5.0,2,N,NA,36,Y,103,https://www.noon.com/uae-en/6-pairs-anti-slip-yoga-socks-for-women-non-slip-socks-pilates-socks-for-yoga-pilates-ballet-dance-workout/Z7918EF223E8946F8A08CZ/p/?o=z7918ef223e8946f8a08cz-1
2024-12-21 17:32:38,ZCADEF018884B7A285E7EZ,Generic The World's Best Eco Friendly Non Slip Yoga Mat With The ORIGINAL Unique Alignment Marker System Biodegradable Mat Made With Natural Rubber  A Warrior like Grip ,Generic,NA,NA,N, ,159.60,Y,101,https://www.noon.com/uae-en/the-world-s-best-eco-friendly-non-slip-yoga-mat-with-the-original-unique-alignment-marker-system-biodegradable-mat-made-with-natural-rubber-a-warrior-like-grip/ZCADEF018884B7A285E7EZ/p/?o=zcadef018884b7a285e7ez-1
2024-12-21 17:32:38,Z0BBD9C7C83B7E8DF4FD6Z,"RIGID FITNESS Microfiber Gym Towel - Face Towel, Yoga Towel - Quick Dry & High Absorbent Sweat Towel For Gym Exercises and Outdoor - Thick 400Gsm - 75x35cm-Grey ",RIGID FITNESS,4.1,20,N,NA,45.75,N,102,https://www.noon.com/uae-en/microfiber-gym-towel-face-towel-yoga-towel-quick-dry-high-absorbent-sweat-towel-for-gym-exercises-and-outdoor-thick-400gsm-75x35cm-grey/Z0BBD9C7C83B7E8DF4FD6Z/p/?o=f433e986d29277cf
2024-12-21 17:32:38,Z538D19FE4FEBB09B4BC8Z,"GROIC Yoga Mat Tote Bag, Yoga Canvas Workout Bag with Yoga Mat Carrier Binding Rope,Canvas Yoga Bag,Gym Bag with Yoga Mat Holder ",GROIC,5.0,2,N, ,62.35,Y,100,https://www.noon.com/uae-en/yoga-mat-tote-bag-yoga-canvas-workout-bag-with-yoga-mat-carrier-binding-rope-canvas-yoga-bag-gym-bag-with-yoga-mat-holder/Z538D19FE4FEBB09B4BC8Z/p/?o=z538d19fe4febb09b4bc8z-1
2024-12-21 17:32:38,N48547358A,limodo Anti-Tear Exercise Mat With Carrying Strap 60x15cm ,limodo,4.9,16,N, ,33.45,Y,99,https://www.noon.com/uae-en/anti-tear-exercise-mat-with-carrying-strap-60x15cm/N48547358A/p/?o=a73e68c31e339e8c
2024-12-21 17:32:38,Z7DD29A3780D77ACC9012Z,Longchamp Le Pliage Original Large Paper White Women's Handbag L1899089P71 ,Longchamp,NA,NA,N,NA,165,Y,98,https://www.noon.com/uae-en/le-pliage-original-large-paper-white-women-s-handbag-l1899089p71/Z7DD29A3780D77ACC9012Z/p/?o=z7dd29a3780d77acc9012z-1
2024-12-21 17:32:38,ZB78840EF57490BD48D7BZ,Generic Round Massager Roller For Waist Abdominal Muscles Ring Leg Clip Stovepipe To Clear The Meridian Portable Cellulite Massage ,Generic,NA,NA,N,NA,140,Y,95,https://www.noon.com/uae-en/round-massager-roller-for-waist-abdominal-muscles-ring-leg-clip-stovepipe-to-clear-the-meridian-portable-cellulite-massage/ZB78840EF57490BD48D7BZ/p/?o=zb78840ef57490bd48d7bz-1
2024-12-21 17:32:38,N20034888A,Generic Pilates Fitness Circle Ring 38X38cm ,Generic,4.2,45,N,NA,30.80,Y,97,https://www.noon.com/uae-en/pilates-fitness-circle-ring-38x38cm/N20034888A/p/?o=d4c16ece448fe3eb
2024-12-21 17:32:38,ZCBE37221BDED873009B5Z,Prickly Pear Prickly Pear Beige Rollable 4mm Non-Slip Yoga Mat with Carry Strap/Stretching Tool - Premium Exercise Mat ,Prickly Pear,NA,NA,N, ,275,Y,94,https://www.noon.com/uae-en/prickly-pear-beige-rollable-4mm-non-slip-yoga-mat-with-carry-strap-stretching-tool-premium-exercise-mat/ZCBE37221BDED873009B5Z/p/?o=zcbe37221bded873009b5z-1
2024-12-21 17:32:38,N30510959A,Generic Yoga Hemisphere Ball Yoga Balance Stability Trainer Exercise 58 x 23cm ,Generic,4.4,12,N,NA,145,N,93,https://www.noon.com/uae-en/yoga-hemisphere-ball-yoga-balance-stability-trainer-exercise-58-x-23cm/N30510959A/p/?o=c1297993bf63547b
2024-12-21 17:32:38,Z288231EEFD4008FE0C11Z,RIOXS 5 Pairs Yoga Socks For Women Non-Slip Grips & Straps Non Slip Socks For Yoga Pilates Ideal For Pilates Ballet Dance Barefoot Workout ,RIOXS,NA,NA,N, ,46.05,Y,96,https://www.noon.com/uae-en/5-pairs-yoga-socks-for-women-non-slip-grips-straps-non-slip-socks-for-yoga-pilates-ideal-for-pilates-ballet-dance-barefoot-workout/Z288231EEFD4008FE0C11Z/p/?o=z288231eefd4008fe0c11z-1
2024-12-21 17:32:38,N27330532A,Fitness World Yoga Mat 1meter ,Fitness World,4.4,88,N,NA,39.75,Y,92,https://www.noon.com/uae-en/yoga-mat-1meter/N27330532A/p/?o=b9b77fe99f710c6e
2024-12-21 17:32:38,ZB6A26C6FF922D524ABBAZ,MahMir MahMir Yoga Mat Anti-Slip Exercise Mat with Carrying Bag Fitness Mat for Pilates 183CM*61CM*6MM Thickness for Woman Man Beginners  Black+Light Grey ,MahMir,4.8,14,N, ,49.95,Y,91,https://www.noon.com/uae-en/mahmir-yoga-mat-anti-slip-exercise-mat-with-carrying-bag-fitness-mat-for-pilates-183cm-61cm-6mm-thickness-for-woman-man-beginners-black-light-grey/ZB6A26C6FF922D524ABBAZ/p/?o=zb6a26c6ff922d524abbaz-1
2024-12-21 17:32:38,ZC40EA8B4693C1223B885Z,RATSAW High Density Yoga Foam Roller for Back Legs Exercise Massage Muscle Recovery and for Pain Relief Great for Fitness Enthusiasts of all Levels 60Cm Perfect for Developing Core and Stamina ,RATSAW,4.3,3,N, ,69,Y,90,https://www.noon.com/uae-en/high-density-yoga-foam-roller-for-back-legs-exercise-massage-muscle-recovery-and-for-pain-relief-great-for-fitness-enthusiasts-of-all-levels-60cm-perfect-for-developing-core-and-stamina/ZC40EA8B4693C1223B885Z/p/?o=zc40ea8b4693c1223b885z-1
2024-12-21 17:32:38,Z221CC6C77CF371DDC115Z,Muyixin 6 Pairs Anti Slip Socks Women Pilates Grip Socks for Sports Yoga Barre ,Muyixin,NA,NA,N, ,75.90,Y,89,https://www.noon.com/uae-en/6-pairs-anti-slip-socks-women-pilates-grip-socks-for-sports-yoga-barre/Z221CC6C77CF371DDC115Z/p/?o=z221cc6c77cf371ddc115z-1
2024-12-21 17:32:38,Z5B95A4E25D4F219BBF89Z,Adidas Fitness Mat - 7Mm - Solar Red ,Adidas,NA,NA,N, ,105,Y,88,https://www.noon.com/uae-en/fitness-mat-7mm-solar-red/Z5B95A4E25D4F219BBF89Z/p/?o=z5b95a4e25d4f219bbf89z-1
2024-12-21 17:32:38,Z3F95B162CE89D5F0E378Z,"GROIC Yoga Mat, Extra Wide 72""x 31.5"" x 0.24"" Pilates Fitness Mats with Alignment Marks, Non Slip Fitness Yoga Mats, Exercise Mats for Yoga Pilates Home Floor Workout with Carrying Sling and Storage Bag ",GROIC,5.0,1,N, ,119.65,Y,86,https://www.noon.com/uae-en/yoga-mat-extra-wide-72-x-31-5-x-0-24-pilates-fitness-mats-with-alignment-marks-non-slip-fitness-yoga-mats-exercise-mats-for-yoga-pilates-home-floor-workout-with-carrying-sling-and-storage-bag/Z3F95B162CE89D5F0E378Z/p/?o=z3f95b162ce89d5f0e378z-1
2024-12-21 17:32:38,ZB5F2579CDC9F9A6C36F2Z,Generic Fittex Tough Non-Slip 10mm Thick Yoga Mat with Carry Strap 188 x 61 x 1 cm Grey ,Generic,4.5,36,N, ,31.50,N,83,https://www.noon.com/uae-en/fittex-tough-non-slip-10mm-thick-yoga-mat-with-carry-strap-188-x-61-x-1-cm-grey/ZB5F2579CDC9F9A6C36F2Z/p/?o=zb5f2579cdc9f9a6c36f2z-1
2024-12-21 17:32:38,ZB95DF9BD1990C80645E2Z,Gaiam 4MM GRAPE CLUSTER 2-COLOR YOGA MAT ,Gaiam,NA,NA,N, ,82,Y,84,https://www.noon.com/uae-en/4mm-grape-cluster-2-color-yoga-mat/ZB95DF9BD1990C80645E2Z/p/?o=zb95df9bd1990c80645e2z-1
2024-12-21 17:32:38,N30510957A,Generic Set Of 2 Yoga Block Props Brick ,Generic,4.7,35,N,NA,30.45,Y,81,https://www.noon.com/uae-en/set-of-2-yoga-block-props-brick/N30510957A/p/?o=da284812d39a3a2c
2024-12-21 17:32:38,3,"Generic 3Pack Chicken Leg Socks, Chicken Feet Stockings, Cotton Knee Thigh High Socks Novelty Pattern Athletic Socks for Women Girls Striped Socks Funny Gifts ",Generic,NA,NA,N, ,49,Y,85,https://www.noon.com/uae-en/3pack-chicken-leg-socks-chicken-feet-stockings-cotton-knee-thigh-high-socks-novelty-pattern-athletic-socks-for-women-girls-striped-socks-funny-gifts/Z1111D3B43FB145CE62DAZ/p/?o=z1111d3b43fb145ce62daz-1
2024-12-21 17:32:38,N43426873A,Generic 184-Piece First Aid Set 21x15x5cm 21x15x5cm ,Generic,4.2,24,N,NA,59,N,87,https://www.noon.com/uae-en/184-piece-first-aid-set-21x15x5cm-21x15x5cm/N43426873A/p/?o=cef378dd08611fbd
2024-12-21 17:32:38,Z1E598CB5A35BDDF0E9C4Z,"Generic Cork Yoga Blocks, 2 Pack, 22.8x15.2x7.6cm, High Density Solid Natural Cork Yoga Brick with Comfortable Edge to Improve Balance, Strength and Flexibility ",Generic,NA,NA,N,NA,66.80,Y,79,https://www.noon.com/uae-en/cork-yoga-blocks-2-pack-22-8x15-2x7-6cm-high-density-solid-natural-cork-yoga-brick-with-comfortable-edge-to-improve-balance-strength-and-flexibility/Z1E598CB5A35BDDF0E9C4Z/p/?o=z1e598cb5a35bddf0e9c4z-1
2024-12-21 17:32:38,Z1FFBA90CF03B4E1CDF5CZ,"MahMir Mahmir® EVA Foam Roller for Yoga, Deep Tissue Massage, Stretching, Physical Therapy, Relieve Stress, Improve Mobility with Foam Roller for Legs and Muscles - Deep Tissue Massage Tool (Light Blue) ",MahMir,3.4,3,N,NA,29.95,N,82,https://www.noon.com/uae-en/mahmir-eva-foam-roller-for-yoga-deep-tissue-massage-stretching-physical-therapy-relieve-stress-improve-mobility-with-foam-roller-for-legs-and-muscles-deep-tissue-massage-tool-light-blue/Z1FFBA90CF03B4E1CDF5CZ/p/?o=f1e97d654c981d3c
2024-12-21 17:32:38,Z166CFFAB78D35C181A54Z,Generic Sports Fitness Pilates Circle Yoga Ring For Women 38X38cm Pink ,Generic,5.0,1,N, ,30.40,Y,77,https://www.noon.com/uae-en/sports-fitness-pilates-circle-yoga-ring-for-women-38x38cm-pink/Z166CFFAB78D35C181A54Z/p/?o=z166cffab78d35c181a54z-1
2024-12-21 17:32:38,ZEA24FB40EFA91537125FZ,Adidas Fitness Mat - 10Mm - Solar Red ,Adidas,NA,NA,N, ,132,Y,78,https://www.noon.com/uae-en/fitness-mat-10mm-solar-red/ZEA24FB40EFA91537125FZ/p/?o=zea24fb40efa91537125fz-1
2024-12-21 17:32:38,Z230C9460E2B3F2772EA3Z,"YooA 3-Pair Non-slip Yoga Socks, Cotton Pilates Socks with Straps, Breathable&Moisture-wicking&Machine-washable, Ideal for Yoga/Pilates/Ballet/Dance/Workout (Purple+Black+Grey, Fit Size 36-42) ",YooA,5.0,3,N, ,35.80,Y,75,https://www.noon.com/uae-en/3-pair-non-slip-yoga-socks-cotton-pilates-socks-with-straps-breathable-moisture-wicking-machine-washable-ideal-for-yoga-pilates-ballet-dance-workout-purple-black-grey-fit-size-36-42/Z230C9460E2B3F2772EA3Z/p/?o=z230c9460e2b3f2772ea3z-1
2024-12-21 17:32:38,Z027D99E609B451C92CE3Z,Gaiam 5MM JUTE YOGA MAT ,Gaiam,NA,NA,N, ,126,Y,76,https://www.noon.com/uae-en/5mm-jute-yoga-mat/Z027D99E609B451C92CE3Z/p/?o=z027d99e609b451c92ce3z-1
2024-12-21 17:32:38,Z31FC466FC0B39E7240FCZ,Generic Pilates Yoga Wedge Massage Correction Yoga Foam Kyphosis Correction Detachable Large Spine Yoga Equipment ,Generic,NA,NA,N, ,239.20,Y,73,https://www.noon.com/uae-en/pilates-yoga-wedge-massage-correction-yoga-foam-kyphosis-correction-detachable-large-spine-yoga-equipment/Z31FC466FC0B39E7240FCZ/p/?o=z31fc466fc0b39e7240fcz-1
2024-12-21 17:32:38,Z9C7EDB5B7C3F9876CCB7Z,Adidas Fitness Mat - 10Mm - Red ,Adidas,NA,NA,N, ,105,Y,72,https://www.noon.com/uae-en/fitness-mat-10mm-red/Z9C7EDB5B7C3F9876CCB7Z/p/?o=z9c7edb5b7c3f9876ccb7z-1
2024-12-21 17:32:38,Z2130DCBA24F1310809F6Z,"GROIC Fitness Yoga Mat for Women and Men - Large, 4mm Thick, 68 Inch *24 Inch, Non Slip Exercise Mats w/ 70 Printed Yoga Poses for Pilates, Workout and Stretching - Home and Gym Essentials ",GROIC,5.0,1,N, ,90.15,Y,71,https://www.noon.com/uae-en/fitness-yoga-mat-for-women-and-men-large-4mm-thick-68-inch-24-inch-non-slip-exercise-mats-w-70-printed-yoga-poses-for-pilates-workout-and-stretching-home-and-gym-essentials/Z2130DCBA24F1310809F6Z/p/?o=z2130dcba24f1310809f6z-1
